{
  "basename": "synthetic-example.pt-BR.pdf",
  "sha256": "0000000000000000000000000000000000000000000000000000000000000000",
  "lang": "pt-BR",
  "checked": {
    "pass1": "synthetic (self-authored, no PDF)",
    "pass2": "synthetic (self-authored, no PDF)",
    "date": "2026-09-23"
  },
  "pages": [
    {
      "page": 1,
      "defectTags": ["hyphen-broken", "header-footer"],
      "goldText": "O desejo da oficina era um desenho cooperativo para o observatório. A Figura 3-1 mostra o alimentador, e o orçamento de maio foi R$ 1.234,56.",
      "readingOrder": ["b1", "b2"],
      "blocks": [
        { "id": "b1", "anchor": "O desejo da oficina" },
        { "id": "b2", "anchor": "A Figura 3-1 mostra" }
      ],
      "excludedSpans": [
        { "role": "header", "text": "Notas de Campo sobre Pássaros" },
        { "role": "page-number", "text": "1" }
      ],
      "spoken": [
        {
          "source": "Figura 3-1",
          "spoken": "figura três um",
          "note": "tracejado = sequência de dígitos, não 'até'"
        },
        {
          "source": "R$ 1.234,56",
          "spoken": "mil duzentos e trinta e quatro reais e cinquenta e seis centavos",
          "note": "form derived from the shipped ptInteger grammar (never 'um mil')"
        }
      ]
    },
    {
      "page": 2,
      "defectTags": ["clean-control"],
      "goldText": "Toda noite o rio levava três barquinhos para lá do moinho.",
      "readingOrder": ["b1"],
      "blocks": [{ "id": "b1", "anchor": "Toda noite o rio" }]
    }
  ]
}
